{
 "schema_version": "1.0",
 "package": {
  "name": "time-gate",
  "version": "0.1",
  "ecosystem": "pypi",
  "sha256": "1a125233948def2bdef9fc5b5698acf50938afbc195c17dd63fb2584c3e99d06",
  "path": "bench/packages/malicious/time_gate"
 },
 "run": {
  "sandbox": "bwrap",
  "network": "sinkhole",
  "canaries": [
   "ssh_key",
   "aws_creds",
   "npmrc",
   "gcloud_creds",
   "docker_config",
   "aws_secret_env",
   "github_token_env"
  ],
  "phases": [
   "install",
   "startup",
   "import",
   "call"
  ],
  "profiles": [
   "dev",
   "ci"
  ],
  "variants": [
   "default",
   "clock+30d"
  ],
  "started_at": "2026-10-27T11:55:46.967880+00:00",
  "duration_s": 4.62,
  "stub": false,
  "tool_versions": {
   "python": "Python 3.12.3",
   "bwrap": "bubblewrap 0.9.0",
   "strace": "strace -- version 6.8",
   "libfaketime": "/usr/lib/x86_64-linux-gnu/faketime/libfaketime.so.1"
  }
 },
 "events": [
  {
   "id": "ev0",
   "seq": 106,
   "phase": "call",
   "trigger": "call_all",
   "profile": "dev",
   "variant": "clock+30d",
   "capability": "network",
   "detail": {
    "url": "http://198.51.100.40/clock",
    "method": "GET",
    "data_head": "",
    "headers": ""
   },
   "canary_hit": false,
   "canary_ids": [],
   "outcome": "blocked",
   "attributed_to": "pkg",
   "evidence": {
    "file": "/w/installed/time_gate/__init__.py",
    "line": 11,
    "layer": "audit"
   }
  },
  {
   "id": "ev1",
   "seq": 107,
   "phase": "call",
   "trigger": "call_all",
   "profile": "dev",
   "variant": "clock+30d",
   "capability": "network",
   "detail": {
    "host": "198.51.100.40"
   },
   "canary_hit": false,
   "canary_ids": [],
   "outcome": "blocked",
   "attributed_to": "pkg",
   "evidence": {
    "file": "/w/installed/time_gate/__init__.py",
    "line": 11,
    "layer": "audit"
   }
  },
  {
   "id": "ev2",
   "seq": 108,
   "phase": "call",
   "trigger": "call_all",
   "profile": "dev",
   "variant": "clock+30d",
   "capability": "network",
   "detail": {
    "dest": "198.51.100.40:80"
   },
   "canary_hit": false,
   "canary_ids": [],
   "outcome": "blocked",
   "attributed_to": "pkg",
   "evidence": {
    "file": "/w/installed/time_gate/__init__.py",
    "line": 11,
    "layer": "audit"
   }
  },
  {
   "id": "ev3",
   "seq": 215,
   "phase": "call",
   "trigger": "call_all",
   "profile": "ci",
   "variant": "clock+30d",
   "capability": "network",
   "detail": {
    "url": "http://198.51.100.40/clock",
    "method": "GET",
    "data_head": "",
    "headers": ""
   },
   "canary_hit": false,
   "canary_ids": [],
   "outcome": "blocked",
   "attributed_to": "pkg",
   "evidence": {
    "file": "/w/installed/time_gate/__init__.py",
    "line": 11,
    "layer": "audit"
   }
  },
  {
   "id": "ev4",
   "seq": 216,
   "phase": "call",
   "trigger": "call_all",
   "profile": "ci",
   "variant": "clock+30d",
   "capability": "network",
   "detail": {
    "host": "198.51.100.40"
   },
   "canary_hit": false,
   "canary_ids": [],
   "outcome": "blocked",
   "attributed_to": "pkg",
   "evidence": {
    "file": "/w/installed/time_gate/__init__.py",
    "line": 11,
    "layer": "audit"
   }
  },
  {
   "id": "ev5",
   "seq": 217,
   "phase": "call",
   "trigger": "call_all",
   "profile": "ci",
   "variant": "clock+30d",
   "capability": "network",
   "detail": {
    "dest": "198.51.100.40:80"
   },
   "canary_hit": false,
   "canary_ids": [],
   "outcome": "blocked",
   "attributed_to": "pkg",
   "evidence": {
    "file": "/w/installed/time_gate/__init__.py",
    "line": 11,
    "layer": "audit"
   }
  }
 ],
 "static_signals": [],
 "coverage": {
  "phases_run": [
   "install",
   "startup",
   "import",
   "call"
  ],
  "profiles_run": [
   "dev",
   "ci"
  ],
  "variants_run": [
   "default",
   "clock+30d"
  ],
  "triggers_run": [
   "call_all",
   "fresh_startup",
   "import_all",
   "install"
  ],
  "install_completed": true,
  "install_note": null,
  "network": "sinkhole",
  "callables_total": 1,
  "callables_exercised": 1,
  "native_skipped": [],
  "strace_layer": true,
  "not_observed": [
   "no console-script entry points to run"
  ],
  "whitelisted_or_dropped_events": 212
 },
 "canaries": [
  {
   "id": "ssh_key",
   "kind": "file",
   "where": ".ssh/id_rsa",
   "token": "TLCANARYSSHKEY72d3a44cd2f8"
  },
  {
   "id": "aws_creds",
   "kind": "file",
   "where": ".aws/credentials",
   "token": "TLCANARYAWSCREDS1e4504fb5f8b"
  },
  {
   "id": "npmrc",
   "kind": "file",
   "where": ".npmrc",
   "token": "TLCANARYNPMRC1a827a49ff05"
  },
  {
   "id": "gcloud_creds",
   "kind": "file",
   "where": ".config/gcloud/application_default_credentials.json",
   "token": "TLCANARYGCLOUDCREDS00a81e0425bb"
  },
  {
   "id": "docker_config",
   "kind": "file",
   "where": ".docker/config.json",
   "token": "TLCANARYDOCKERCONFIG1e3670f759be"
  },
  {
   "id": "aws_secret_env",
   "kind": "env",
   "where": "AWS_SECRET_ACCESS_KEY",
   "token": "TLCANARYAWSSECRETENVb0fa229f33fa"
  },
  {
   "id": "github_token_env",
   "kind": "env",
   "where": "GITHUB_TOKEN",
   "token": "TLCANARYGITHUBTOKENENV107cbde8a3bf"
  }
 ],
 "capability_summary": {
  "network": {
   "phases": [
    "call"
   ],
   "profiles": [
    "ci",
    "dev"
   ],
   "conditional": true,
   "count": 6,
   "canary_hit": false
  }
 }
}
