{
 "schema_version": "1.0",
 "package": {
  "name": "host-gate",
  "version": "0.1",
  "ecosystem": "pypi",
  "sha256": "a24ce8fab0ab7551cd6c4be98cfcf5a49751d0e2d4680fc4765da355ac44744d",
  "path": "bench/packages/malicious/host_gate"
 },
 "run": {
  "sandbox": "bwrap",
  "network": "sinkhole",
  "canaries": [
   "ssh_key",
   "aws_creds",
   "npmrc",
   "gcloud_creds",
   "docker_config",
   "aws_secret_env",
   "github_token_env"
  ],
  "phases": [
   "install",
   "startup",
   "import",
   "call"
  ],
  "profiles": [
   "dev",
   "ci"
  ],
  "variants": [
   "default",
   "clock+30d"
  ],
  "started_at": "2026-10-27T11:55:51.965154+00:00",
  "duration_s": 4.71,
  "stub": false,
  "tool_versions": {
   "python": "Python 3.12.3",
   "bwrap": "bubblewrap 0.9.0",
   "strace": "strace -- version 6.8",
   "libfaketime": "/usr/lib/x86_64-linux-gnu/faketime/libfaketime.so.1"
  }
 },
 "events": [
  {
   "id": "ev0",
   "seq": 106,
   "phase": "call",
   "trigger": "call_all",
   "profile": "dev",
   "variant": "default",
   "capability": "sandbox_probe",
   "detail": {
    "name": "HOSTNAME",
    "via": "gethostname",
    "count": 3
   },
   "canary_hit": false,
   "canary_ids": [],
   "outcome": "succeeded",
   "attributed_to": "pkg",
   "evidence": {
    "file": "/w/installed/host_gate/__init__.py",
    "line": 8,
    "layer": "env"
   },
   "count": 3
  },
  {
   "id": "ev1",
   "seq": 109,
   "phase": "call",
   "trigger": "call_all",
   "profile": "dev",
   "variant": "clock+30d",
   "capability": "sandbox_probe",
   "detail": {
    "name": "HOSTNAME",
    "via": "gethostname",
    "count": 3
   },
   "canary_hit": false,
   "canary_ids": [],
   "outcome": "succeeded",
   "attributed_to": "pkg",
   "evidence": {
    "file": "/w/installed/host_gate/__init__.py",
    "line": 8,
    "layer": "env"
   },
   "count": 3
  },
  {
   "id": "ev2",
   "seq": 218,
   "phase": "call",
   "trigger": "call_all",
   "profile": "ci",
   "variant": "default",
   "capability": "sandbox_probe",
   "detail": {
    "name": "HOSTNAME",
    "via": "gethostname",
    "count": 3
   },
   "canary_hit": false,
   "canary_ids": [],
   "outcome": "succeeded",
   "attributed_to": "pkg",
   "evidence": {
    "file": "/w/installed/host_gate/__init__.py",
    "line": 8,
    "layer": "env"
   },
   "count": 3
  },
  {
   "id": "ev3",
   "seq": 219,
   "phase": "call",
   "trigger": "call_all",
   "profile": "ci",
   "variant": "default",
   "capability": "network",
   "detail": {
    "url": "http://198.51.100.21/host",
    "method": "GET",
    "data_head": "",
    "headers": "",
    "count": 3
   },
   "canary_hit": false,
   "canary_ids": [],
   "outcome": "blocked",
   "attributed_to": "pkg",
   "evidence": {
    "file": "/w/installed/host_gate/__init__.py",
    "line": 10,
    "layer": "audit"
   },
   "count": 3
  },
  {
   "id": "ev4",
   "seq": 220,
   "phase": "call",
   "trigger": "call_all",
   "profile": "ci",
   "variant": "default",
   "capability": "network",
   "detail": {
    "host": "198.51.100.21",
    "count": 3
   },
   "canary_hit": false,
   "canary_ids": [],
   "outcome": "blocked",
   "attributed_to": "pkg",
   "evidence": {
    "file": "/w/installed/host_gate/__init__.py",
    "line": 10,
    "layer": "audit"
   },
   "count": 3
  },
  {
   "id": "ev5",
   "seq": 221,
   "phase": "call",
   "trigger": "call_all",
   "profile": "ci",
   "variant": "default",
   "capability": "network",
   "detail": {
    "dest": "198.51.100.21:80",
    "count": 3
   },
   "canary_hit": false,
   "canary_ids": [],
   "outcome": "blocked",
   "attributed_to": "pkg",
   "evidence": {
    "file": "/w/installed/host_gate/__init__.py",
    "line": 10,
    "layer": "audit"
   },
   "count": 3
  },
  {
   "id": "ev6",
   "seq": 230,
   "phase": "call",
   "trigger": "call_all",
   "profile": "ci",
   "variant": "clock+30d",
   "capability": "sandbox_probe",
   "detail": {
    "name": "HOSTNAME",
    "via": "gethostname",
    "count": 3
   },
   "canary_hit": false,
   "canary_ids": [],
   "outcome": "succeeded",
   "attributed_to": "pkg",
   "evidence": {
    "file": "/w/installed/host_gate/__init__.py",
    "line": 8,
    "layer": "env"
   },
   "count": 3
  },
  {
   "id": "ev7",
   "seq": 231,
   "phase": "call",
   "trigger": "call_all",
   "profile": "ci",
   "variant": "clock+30d",
   "capability": "network",
   "detail": {
    "url": "http://198.51.100.21/host",
    "method": "GET",
    "data_head": "",
    "headers": "",
    "count": 3
   },
   "canary_hit": false,
   "canary_ids": [],
   "outcome": "blocked",
   "attributed_to": "pkg",
   "evidence": {
    "file": "/w/installed/host_gate/__init__.py",
    "line": 10,
    "layer": "audit"
   },
   "count": 3
  },
  {
   "id": "ev8",
   "seq": 232,
   "phase": "call",
   "trigger": "call_all",
   "profile": "ci",
   "variant": "clock+30d",
   "capability": "network",
   "detail": {
    "host": "198.51.100.21",
    "count": 3
   },
   "canary_hit": false,
   "canary_ids": [],
   "outcome": "blocked",
   "attributed_to": "pkg",
   "evidence": {
    "file": "/w/installed/host_gate/__init__.py",
    "line": 10,
    "layer": "audit"
   },
   "count": 3
  },
  {
   "id": "ev9",
   "seq": 233,
   "phase": "call",
   "trigger": "call_all",
   "profile": "ci",
   "variant": "clock+30d",
   "capability": "network",
   "detail": {
    "dest": "198.51.100.21:80",
    "count": 3
   },
   "canary_hit": false,
   "canary_ids": [],
   "outcome": "blocked",
   "attributed_to": "pkg",
   "evidence": {
    "file": "/w/installed/host_gate/__init__.py",
    "line": 10,
    "layer": "audit"
   },
   "count": 3
  }
 ],
 "static_signals": [],
 "coverage": {
  "phases_run": [
   "install",
   "startup",
   "import",
   "call"
  ],
  "profiles_run": [
   "dev",
   "ci"
  ],
  "variants_run": [
   "default",
   "clock+30d"
  ],
  "triggers_run": [
   "call_all",
   "fresh_startup",
   "import_all",
   "install"
  ],
  "install_completed": true,
  "install_note": null,
  "network": "sinkhole",
  "callables_total": 1,
  "callables_exercised": 1,
  "native_skipped": [],
  "strace_layer": true,
  "not_observed": [
   "no console-script entry points to run"
  ],
  "whitelisted_or_dropped_events": 232
 },
 "canaries": [
  {
   "id": "ssh_key",
   "kind": "file",
   "where": ".ssh/id_rsa",
   "token": "TLCANARYSSHKEYed50012e9305"
  },
  {
   "id": "aws_creds",
   "kind": "file",
   "where": ".aws/credentials",
   "token": "TLCANARYAWSCREDSc317528c783b"
  },
  {
   "id": "npmrc",
   "kind": "file",
   "where": ".npmrc",
   "token": "TLCANARYNPMRCe0cde5510c07"
  },
  {
   "id": "gcloud_creds",
   "kind": "file",
   "where": ".config/gcloud/application_default_credentials.json",
   "token": "TLCANARYGCLOUDCREDSc5e50d12a363"
  },
  {
   "id": "docker_config",
   "kind": "file",
   "where": ".docker/config.json",
   "token": "TLCANARYDOCKERCONFIGb095af569fcc"
  },
  {
   "id": "aws_secret_env",
   "kind": "env",
   "where": "AWS_SECRET_ACCESS_KEY",
   "token": "TLCANARYAWSSECRETENV61d3d15670cb"
  },
  {
   "id": "github_token_env",
   "kind": "env",
   "where": "GITHUB_TOKEN",
   "token": "TLCANARYGITHUBTOKENENV4d8b1d099496"
  }
 ],
 "capability_summary": {
  "network": {
   "phases": [
    "call"
   ],
   "profiles": [
    "ci"
   ],
   "conditional": true,
   "count": 6,
   "canary_hit": false
  },
  "sandbox_probe": {
   "phases": [
    "call"
   ],
   "profiles": [
    "ci",
    "dev"
   ],
   "conditional": false,
   "count": 4,
   "canary_hit": false
  }
 }
}
