{
 "schema_version": "1.0",
 "package": {
  "name": "clean-slug",
  "version": "0.1",
  "ecosystem": "pypi",
  "sha256": "c66e93f5a8a43907d65573b7e7efa0d4433a37472f5ada099b9bde8f5f67f4d5",
  "path": "bench/packages/clean/clean_slug"
 },
 "run": {
  "sandbox": "bwrap",
  "network": "blocked",
  "canaries": [
   "ssh_key",
   "aws_creds",
   "npmrc",
   "aws_secret_env",
   "github_token_env"
  ],
  "phases": [
   "install",
   "import",
   "call"
  ],
  "profiles": [
   "dev",
   "ci"
  ],
  "variants": [
   "default"
  ],
  "started_at": "2026-10-25T21:07:45.913285+00:00",
  "duration_s": 0.76,
  "stub": false
 },
 "events": [],
 "static_signals": [],
 "coverage": {
  "phases_run": [
   "install",
   "import",
   "call"
  ],
  "profiles_run": [
   "dev",
   "ci"
  ],
  "variants_run": [
   "default"
  ],
  "triggers_run": [
   "call_all",
   "import_all",
   "install"
  ],
  "install_completed": true,
  "install_note": null,
  "network": "blocked",
  "callables_total": 1,
  "callables_exercised": 1,
  "native_skipped": [],
  "strace_layer": false,
  "not_observed": [
   "real `pip install` (wheel/.pth/sitecustomize) not exercised (v0 uses setup.py egg_info)",
   "fresh-interpreter startup not tested",
   "clock+30d variant not run",
   "CLI entry points not run",
   "strace layer not active (native code is invisible)"
  ],
  "whitelisted_or_dropped_events": 0
 },
 "canaries": [
  {
   "id": "ssh_key",
   "kind": "file",
   "where": ".ssh/id_rsa",
   "token": "TLCANARYSSHKEY2b4f159b5878"
  },
  {
   "id": "aws_creds",
   "kind": "file",
   "where": ".aws/credentials",
   "token": "TLCANARYAWSCREDS54e6fbf341e6"
  },
  {
   "id": "npmrc",
   "kind": "file",
   "where": ".npmrc",
   "token": "TLCANARYNPMRCe27390fcbad4"
  },
  {
   "id": "aws_secret_env",
   "kind": "env",
   "where": "AWS_SECRET_ACCESS_KEY",
   "token": "TLCANARYAWSSECRETENV966016ca1935"
  },
  {
   "id": "github_token_env",
   "kind": "env",
   "where": "GITHUB_TOKEN",
   "token": "TLCANARYGITHUBTOKENENV22f731b09083"
  }
 ],
 "capability_summary": {}
}
