{
 "schema_version": "1.0",
 "package": {
  "name": "uuid-helper",
  "version": "0.1",
  "ecosystem": "pypi",
  "sha256": "b5c1527f6ff5a1820b57aafd9606424afc41c5969e79413e2fa38d719ec0955e",
  "path": "bench/packages/clean/uuid_helper"
 },
 "run": {
  "sandbox": "bwrap",
  "network": "sinkhole",
  "canaries": [
   "ssh_key",
   "aws_creds",
   "npmrc",
   "gcloud_creds",
   "docker_config",
   "aws_secret_env",
   "github_token_env"
  ],
  "phases": [
   "install",
   "startup",
   "import",
   "call"
  ],
  "profiles": [
   "dev",
   "ci"
  ],
  "variants": [
   "default",
   "clock+30d"
  ],
  "started_at": "2026-10-27T11:57:17.394410+00:00",
  "duration_s": 5.78,
  "stub": false,
  "tool_versions": {
   "python": "Python 3.12.3",
   "bwrap": "bubblewrap 0.9.0",
   "strace": "strace -- version 6.8",
   "libfaketime": "/usr/lib/x86_64-linux-gnu/faketime/libfaketime.so.1"
  }
 },
 "events": [],
 "static_signals": [],
 "coverage": {
  "phases_run": [
   "install",
   "startup",
   "import",
   "call"
  ],
  "profiles_run": [
   "dev",
   "ci"
  ],
  "variants_run": [
   "default",
   "clock+30d"
  ],
  "triggers_run": [
   "call_all",
   "fresh_startup",
   "import_all",
   "install"
  ],
  "install_completed": true,
  "install_note": null,
  "network": "sinkhole",
  "callables_total": 2,
  "callables_exercised": 2,
  "native_skipped": [],
  "strace_layer": true,
  "not_observed": [
   "no console-script entry points to run"
  ],
  "whitelisted_or_dropped_events": 212
 },
 "canaries": [
  {
   "id": "ssh_key",
   "kind": "file",
   "where": ".ssh/id_rsa",
   "token": "TLCANARYSSHKEY44bd96b339e8"
  },
  {
   "id": "aws_creds",
   "kind": "file",
   "where": ".aws/credentials",
   "token": "TLCANARYAWSCREDS3e3c4c92ee52"
  },
  {
   "id": "npmrc",
   "kind": "file",
   "where": ".npmrc",
   "token": "TLCANARYNPMRC7bace881a22a"
  },
  {
   "id": "gcloud_creds",
   "kind": "file",
   "where": ".config/gcloud/application_default_credentials.json",
   "token": "TLCANARYGCLOUDCREDSbb4b2ad6dcf2"
  },
  {
   "id": "docker_config",
   "kind": "file",
   "where": ".docker/config.json",
   "token": "TLCANARYDOCKERCONFIG66a9126c8a45"
  },
  {
   "id": "aws_secret_env",
   "kind": "env",
   "where": "AWS_SECRET_ACCESS_KEY",
   "token": "TLCANARYAWSSECRETENV151452df644d"
  },
  {
   "id": "github_token_env",
   "kind": "env",
   "where": "GITHUB_TOKEN",
   "token": "TLCANARYGITHUBTOKENENV9a5cd8ec58ee"
  }
 ],
 "capability_summary": {}
}
