{
 "schema_version": "1.0",
 "package": {
  "name": "ssh-helper",
  "version": "0.1",
  "ecosystem": "pypi",
  "sha256": "75dcfa135d686e92deb123ab7fdb038b32603393c8313178d9432f5faabc2052",
  "path": "bench/packages/clean/ssh_helper"
 },
 "run": {
  "sandbox": "bwrap",
  "network": "sinkhole",
  "canaries": [
   "ssh_key",
   "aws_creds",
   "npmrc",
   "gcloud_creds",
   "docker_config",
   "aws_secret_env",
   "github_token_env"
  ],
  "phases": [
   "install",
   "startup",
   "import",
   "call"
  ],
  "profiles": [
   "dev",
   "ci"
  ],
  "variants": [
   "default",
   "clock+30d"
  ],
  "started_at": "2026-10-27T11:56:36.282923+00:00",
  "duration_s": 4.74,
  "stub": false,
  "tool_versions": {
   "python": "Python 3.12.3",
   "bwrap": "bubblewrap 0.9.0",
   "strace": "strace -- version 6.8",
   "libfaketime": "/usr/lib/x86_64-linux-gnu/faketime/libfaketime.so.1"
  }
 },
 "events": [
  {
   "id": "ev0",
   "seq": 106,
   "phase": "call",
   "trigger": "call_all",
   "profile": "dev",
   "variant": "default",
   "capability": "fs_read_sensitive",
   "detail": {
    "path": "~/.ssh/config",
    "mode": "r"
   },
   "canary_hit": false,
   "canary_ids": [],
   "outcome": "attempted",
   "attributed_to": "pkg",
   "evidence": {
    "file": "/w/installed/ssh_helper/__init__.py",
    "line": 8,
    "layer": "audit"
   }
  },
  {
   "id": "ev1",
   "seq": 107,
   "phase": "call",
   "trigger": "call_all",
   "profile": "dev",
   "variant": "clock+30d",
   "capability": "fs_read_sensitive",
   "detail": {
    "path": "~/.ssh/config",
    "mode": "r"
   },
   "canary_hit": false,
   "canary_ids": [],
   "outcome": "attempted",
   "attributed_to": "pkg",
   "evidence": {
    "file": "/w/installed/ssh_helper/__init__.py",
    "line": 8,
    "layer": "audit"
   }
  },
  {
   "id": "ev2",
   "seq": 214,
   "phase": "call",
   "trigger": "call_all",
   "profile": "ci",
   "variant": "default",
   "capability": "fs_read_sensitive",
   "detail": {
    "path": "~/.ssh/config",
    "mode": "r"
   },
   "canary_hit": false,
   "canary_ids": [],
   "outcome": "attempted",
   "attributed_to": "pkg",
   "evidence": {
    "file": "/w/installed/ssh_helper/__init__.py",
    "line": 8,
    "layer": "audit"
   }
  },
  {
   "id": "ev3",
   "seq": 215,
   "phase": "call",
   "trigger": "call_all",
   "profile": "ci",
   "variant": "clock+30d",
   "capability": "fs_read_sensitive",
   "detail": {
    "path": "~/.ssh/config",
    "mode": "r"
   },
   "canary_hit": false,
   "canary_ids": [],
   "outcome": "attempted",
   "attributed_to": "pkg",
   "evidence": {
    "file": "/w/installed/ssh_helper/__init__.py",
    "line": 8,
    "layer": "audit"
   }
  }
 ],
 "static_signals": [],
 "coverage": {
  "phases_run": [
   "install",
   "startup",
   "import",
   "call"
  ],
  "profiles_run": [
   "dev",
   "ci"
  ],
  "variants_run": [
   "default",
   "clock+30d"
  ],
  "triggers_run": [
   "call_all",
   "fresh_startup",
   "import_all",
   "install"
  ],
  "install_completed": true,
  "install_note": null,
  "network": "sinkhole",
  "callables_total": 1,
  "callables_exercised": 1,
  "native_skipped": [],
  "strace_layer": true,
  "not_observed": [
   "no console-script entry points to run"
  ],
  "whitelisted_or_dropped_events": 212
 },
 "canaries": [
  {
   "id": "ssh_key",
   "kind": "file",
   "where": ".ssh/id_rsa",
   "token": "TLCANARYSSHKEYe5e4b66a5eb2"
  },
  {
   "id": "aws_creds",
   "kind": "file",
   "where": ".aws/credentials",
   "token": "TLCANARYAWSCREDS001fcb43808d"
  },
  {
   "id": "npmrc",
   "kind": "file",
   "where": ".npmrc",
   "token": "TLCANARYNPMRCb0e3567bde4a"
  },
  {
   "id": "gcloud_creds",
   "kind": "file",
   "where": ".config/gcloud/application_default_credentials.json",
   "token": "TLCANARYGCLOUDCREDSc61bf796fd9a"
  },
  {
   "id": "docker_config",
   "kind": "file",
   "where": ".docker/config.json",
   "token": "TLCANARYDOCKERCONFIGe202bf04ad46"
  },
  {
   "id": "aws_secret_env",
   "kind": "env",
   "where": "AWS_SECRET_ACCESS_KEY",
   "token": "TLCANARYAWSSECRETENV0768ffb9f873"
  },
  {
   "id": "github_token_env",
   "kind": "env",
   "where": "GITHUB_TOKEN",
   "token": "TLCANARYGITHUBTOKENENV6f78e81ca42d"
  }
 ],
 "capability_summary": {
  "fs_read_sensitive": {
   "phases": [
    "call"
   ],
   "profiles": [
    "ci",
    "dev"
   ],
   "conditional": false,
   "count": 4,
   "canary_hit": false
  }
 }
}
