{
 "schema_version": "1.0",
 "package": {
  "name": "markdown-strip",
  "version": "0.1",
  "ecosystem": "pypi",
  "sha256": "e24eef36a78c7e2528fbb375d2638409b07966ccf43e4e71bbc83dc59bc0da74",
  "path": "bench/packages/clean/markdown_strip"
 },
 "run": {
  "sandbox": "bwrap",
  "network": "sinkhole",
  "canaries": [
   "ssh_key",
   "aws_creds",
   "npmrc",
   "gcloud_creds",
   "docker_config",
   "aws_secret_env",
   "github_token_env"
  ],
  "phases": [
   "install",
   "startup",
   "import",
   "call"
  ],
  "profiles": [
   "dev",
   "ci"
  ],
  "variants": [
   "default",
   "clock+30d"
  ],
  "started_at": "2026-10-27T11:57:28.140460+00:00",
  "duration_s": 4.22,
  "stub": false,
  "tool_versions": {
   "python": "Python 3.12.3",
   "bwrap": "bubblewrap 0.9.0",
   "strace": "strace -- version 6.8",
   "libfaketime": "/usr/lib/x86_64-linux-gnu/faketime/libfaketime.so.1"
  }
 },
 "events": [],
 "static_signals": [],
 "coverage": {
  "phases_run": [
   "install",
   "startup",
   "import",
   "call"
  ],
  "profiles_run": [
   "dev",
   "ci"
  ],
  "variants_run": [
   "default",
   "clock+30d"
  ],
  "triggers_run": [
   "call_all",
   "fresh_startup",
   "import_all",
   "install"
  ],
  "install_completed": true,
  "install_note": null,
  "network": "sinkhole",
  "callables_total": 1,
  "callables_exercised": 1,
  "native_skipped": [],
  "strace_layer": true,
  "not_observed": [
   "no console-script entry points to run"
  ],
  "whitelisted_or_dropped_events": 212
 },
 "canaries": [
  {
   "id": "ssh_key",
   "kind": "file",
   "where": ".ssh/id_rsa",
   "token": "TLCANARYSSHKEY135884966069"
  },
  {
   "id": "aws_creds",
   "kind": "file",
   "where": ".aws/credentials",
   "token": "TLCANARYAWSCREDSf16b42a17e7d"
  },
  {
   "id": "npmrc",
   "kind": "file",
   "where": ".npmrc",
   "token": "TLCANARYNPMRC8d5f74dc9442"
  },
  {
   "id": "gcloud_creds",
   "kind": "file",
   "where": ".config/gcloud/application_default_credentials.json",
   "token": "TLCANARYGCLOUDCREDS642657dddefa"
  },
  {
   "id": "docker_config",
   "kind": "file",
   "where": ".docker/config.json",
   "token": "TLCANARYDOCKERCONFIGd25a02a716ca"
  },
  {
   "id": "aws_secret_env",
   "kind": "env",
   "where": "AWS_SECRET_ACCESS_KEY",
   "token": "TLCANARYAWSSECRETENV8049b8412656"
  },
  {
   "id": "github_token_env",
   "kind": "env",
   "where": "GITHUB_TOKEN",
   "token": "TLCANARYGITHUBTOKENENVd156c2de7dcf"
  }
 ],
 "capability_summary": {}
}
